{
  "schema_version": 1,
  "run_id": "450e8a2a-d4fb-49c6-8d86-1b0d0de7b27f",
  "orchestrator_version": "0.1.0",
  "mode": "plan",
  "status": "success",
  "error_code": "OK",
  "started_at": "2026-07-21T10:15:00+00:00",
  "finished_at": "2026-07-21T10:15:01+00:00",
  "duration_ms": 1234,
  "stages": [
    {
      "stage": "validate_config",
      "outcome": "success",
      "error_code": "OK",
      "started_at": "2026-07-21T10:15:00+00:00",
      "finished_at": "2026-07-21T10:15:00+00:00",
      "duration_ms": 50,
      "message": "Configuration validated successfully.",
      "diagnostics": {}
    },
    {
      "stage": "sync_maa_config",
      "outcome": "skipped",
      "error_code": "SKIPPED",
      "started_at": "2026-07-21T10:15:00+00:00",
      "finished_at": "2026-07-21T10:15:00+00:00",
      "duration_ms": 0,
      "message": "Skipped in plan mode.",
      "diagnostics": {}
    }
  ],
  "diagnostics": {}
}
